'id','inScheme','name','description','links','_version','_change_date','_user','_status','_comments'
'https://codes.wmo.int/wmdr/LocalTopography/depression','https://codes.wmo.int/wmdr/LocalTopography','A depression','Lower than surrounding land beyond a 50 m radius, with no surface outlet for water.','[{"type": "text/html", "rel": "canonical", "href": "https://codes.wmo.int/wmdr/LocalTopography/depression"}]',1,'2023-08-17T08:05:32.844330','x-opencdms:admin:user:1','x-opencdms:reference_data:status:1','First automated ingest from codes.wmo.int. Data download on _change_date.'
'https://codes.wmo.int/wmdr/LocalTopography/flat','https://codes.wmo.int/wmdr/LocalTopography','A flat','Slope less than 3 degrees and not a hilltop, ridge, valley bottom or depression.','[{"type": "text/html", "rel": "canonical", "href": "https://codes.wmo.int/wmdr/LocalTopography/flat"}]',1,'2023-08-17T08:05:32.844330','x-opencdms:admin:user:1','x-opencdms:reference_data:status:1','First automated ingest from codes.wmo.int. Data download on _change_date.'
'https://codes.wmo.int/wmdr/LocalTopography/hilltop','https://codes.wmo.int/wmdr/LocalTopography','A hilltop','Higher than all or nearly all of the surrounding land beyond a 50 m radius.','[{"type": "text/html", "rel": "canonical", "href": "https://codes.wmo.int/wmdr/LocalTopography/hilltop"}]',1,'2023-08-17T08:05:32.844330','x-opencdms:admin:user:1','x-opencdms:reference_data:status:1','First automated ingest from codes.wmo.int. Data download on _change_date.'
'https://codes.wmo.int/wmdr/LocalTopography/inapplicable','https://codes.wmo.int/wmdr/LocalTopography','inapplicable','None of the codes in the table are applicable in the context of this particular station/platform.','[{"type": "text/html", "rel": "canonical", "href": "https://codes.wmo.int/wmdr/LocalTopography/inapplicable"}]',1,'2023-08-17T08:05:32.844330','x-opencdms:admin:user:1','x-opencdms:reference_data:status:1','First automated ingest from codes.wmo.int. Data download on _change_date.'
'https://codes.wmo.int/wmdr/LocalTopography/ridge','https://codes.wmo.int/wmdr/LocalTopography','A ridge','Higher than all or nearly all of the surrounding land, but elongated and extending beyond a 50 m radius.','[{"type": "text/html", "rel": "canonical", "href": "https://codes.wmo.int/wmdr/LocalTopography/ridge"}]',1,'2023-08-17T08:05:32.844330','x-opencdms:admin:user:1','x-opencdms:reference_data:status:1','First automated ingest from codes.wmo.int. Data download on _change_date.'
'https://codes.wmo.int/wmdr/LocalTopography/saddle','https://codes.wmo.int/wmdr/LocalTopography','A saddle','A depression located along the axial trend of an anticline; an area confined on two sides by downward slopes and on two sides by upward slopes.','[{"type": "text/html", "rel": "canonical", "href": "https://codes.wmo.int/wmdr/LocalTopography/saddle"}]',1,'2023-08-17T08:05:32.844330','x-opencdms:admin:user:1','x-opencdms:reference_data:status:1','First automated ingest from codes.wmo.int. Data download on _change_date.'
'https://codes.wmo.int/wmdr/LocalTopography/slope','https://codes.wmo.int/wmdr/LocalTopography','A slope','Neither crest nor depression or valley bottom, and with slope more than 3 degrees.','[{"type": "text/html", "rel": "canonical", "href": "https://codes.wmo.int/wmdr/LocalTopography/slope"}]',1,'2023-08-17T08:05:32.844330','x-opencdms:admin:user:1','x-opencdms:reference_data:status:1','First automated ingest from codes.wmo.int. Data download on _change_date.'
'https://codes.wmo.int/wmdr/LocalTopography/unknown','https://codes.wmo.int/wmdr/LocalTopography','unknown','Unknown local topography','[{"type": "text/html", "rel": "canonical", "href": "https://codes.wmo.int/wmdr/LocalTopography/unknown"}]',1,'2023-08-17T08:05:32.844330','x-opencdms:admin:user:1','x-opencdms:reference_data:status:1','First automated ingest from codes.wmo.int. Data download on _change_date.'
'https://codes.wmo.int/wmdr/LocalTopography/valleyBottom','https://codes.wmo.int/wmdr/LocalTopography','A valley bottom','Lower than nearly all of surrounding land beyond a 50 m radius, but water can flow out.','[{"type": "text/html", "rel": "canonical", "href": "https://codes.wmo.int/wmdr/LocalTopography/valleyBottom"}]',1,'2023-08-17T08:05:32.844330','x-opencdms:admin:user:1','x-opencdms:reference_data:status:1','First automated ingest from codes.wmo.int. Data download on _change_date.'
